"week","content_type","target_keyword","url","search_intent"
"1","money guide","s9 game download","download","Primary ranking page"
"1","faq","how to use s9 game download","faq","Question intent"
"2","update","s9 game download latest update","updates","Freshness"
"2","support","Android Install","install/android","Problem solving"
"3","comparison","s9 game download alternative","blog/ranking-review","Comparison intent"
"3","trust","is s9 game download safe","blog/search-intent-map","Trust intent"
"4","local","s9 game download pakistan","updates","Regional intent"
"4","maintenance","S9 Access Center weekly check","blog/weekly-check","Update rhythm"
"5","long-tail article","s9 game download android download route","blog/android-download-route","Long-tail supporting page"
"5","long-tail article","s9 game download install permission check","blog/install-permission-check","Long-tail supporting page"
"6","long-tail article","s9 game download download failed fixes","blog/download-failed-fixes","Long-tail supporting page"
"6","long-tail article","s9 game download latest update route","blog/latest-update-route","Long-tail supporting page"
"7","long-tail article","s9 game download pakistan download notes","blog/pakistan-download-notes","Long-tail supporting page"
"7","long-tail article","s9 game download register before install","blog/register-before-install","Long-tail supporting page"
"8","weekly update","s9 game download week 01 download route audit","updates/week-01-download-route-audit","Freshness and maintenance page"
"8","weekly update","s9 game download week 02 android install test","updates/week-02-android-install-test","Freshness and maintenance page"
"9","weekly update","s9 game download week 03 source link review","updates/week-03-source-link-review","Freshness and maintenance page"
"9","weekly update","s9 game download week 04 registration path check","updates/week-04-registration-path-check","Freshness and maintenance page"
"10","weekly update","s9 game download week 05 failed download cases","updates/week-05-failed-download-cases","Freshness and maintenance page"
"10","weekly update","s9 game download week 06 mobile speed review","updates/week-06-mobile-speed-review","Freshness and maintenance page"
"11","weekly update","s9 game download week 07 pakistan access note","updates/week-07-pakistan-access-note","Freshness and maintenance page"
"11","weekly update","s9 game download week 08 version note refresh","updates/week-08-version-note-refresh","Freshness and maintenance page"
"12","weekly update","s9 game download week 09 faq rewrite","updates/week-09-faq-rewrite","Freshness and maintenance page"
"12","weekly update","s9 game download week 10 internal link pass","updates/week-10-internal-link-pass","Freshness and maintenance page"
"13","weekly update","s9 game download week 11 serp title test","updates/week-11-serp-title-test","Freshness and maintenance page"
"13","weekly update","s9 game download week 12 conversion check","updates/week-12-conversion-check","Freshness and maintenance page"
"sprint-2026-06-13","long-tail support","s9 game download s9 game download link not opening on android","blog/android-download-not-opening","download troubleshooting page 1"
"sprint-2026-06-13","long-tail support","s9 game download how to fix browser install blocked warnings","blog/install-blocked-by-browser","Android install help page 2"
"sprint-2026-06-13","long-tail support","s9 game download download page vs register page: which one should users open first?","blog/download-page-vs-register-page","download intent comparison page 3"
"register-login-2026-06-13","register-login cluster","s9 game download s9 download before register checklist","blog/download-before-register-checklist","download/register bridge"
"register-login-2026-06-13","register-login cluster","s9 game download register after apk install: android first-run steps","blog/register-after-apk-install","post-install registration"
"register-login-2026-06-13","register-login cluster","s9 game download unknown sources warning before s9 registration","blog/unknown-sources-register-risk","install permission safety"
"account-wallet-support-2026-06-13","support cluster","s9 download restart after register fails","blog/download-restart-after-register-fails","download recovery"
"account-wallet-support-2026-06-13","support cluster","what to include in an s9 download support ticket","blog/download-source-support-ticket","download recovery"
"daily-2026-06-14","daily freshness","chrome download warning before s9 register","blog/chrome-download-warning-before-register","download warning before registration"
"pillar-2026-06-14","pillar hub","s9 game download help","download-help","download route authority"
"daily-2026-06-16","daily support page","s9 apk download not starting on android","blog/apk-download-not-starting-on-android","Android download start failure"
"serp-intent","SERP intent page","s9 game download","blog/s9-game-download-guide-2026-06-17/","download"
"daily-2026-06-17","long-tail intent","s9 game download complete path","blog/s9-game-download-guide-2026-06-17","daily ranking support"
"daily-2026-06-17","long-tail intent","s9 game app size check pakistan","blog/s9-game-app-size-check-2026-06-17","daily ranking support"
"daily-2026-06-18","long-tail intent","S9 Game APK Guide for Pakistan","blog/s9-game-download-guide-2026-06-18/","intent"
"second-wave-longtail","Support intent page","s9 game download failed after register","blog/s9-download-failed-after-register-2026-06-18/","download recovery"
"daily-2026-06-19","long-tail intent","S9 Game APK Guide for Pakistan","blog/s9-game-download-guide-2026-06-19/","intent"
"serp-intent","SERP intent page","s9 game download","blog/s9-game-download-guide-2026-06-19/","download"
"serp-intent","SERP intent page","s9 game download","blog/s9-game-download-guide-2026-06-19/","download"
"serp-intent","SERP intent page","s9 game download","blog/s9-game-download-guide-2026-06-20/","download"
"serp-intent","SERP intent page","s9 game download","blog/s9-game-download-guide-2026-06-24/","download"
"serp-intent","SERP intent page","s9 game download","blog/s9-game-download-guide-2026-06-26/","download"
"competitor-response","Competitor gap response","s9 game download Pakistan","blog/download-serp-gap-response-2026-06-28/","download"
"ranking-push","Competitor gap depth page","s9 download link not opening Pakistan","blog/s9-download-link-not-opening-2026-06-29/","download-failure"
"ranking-push","Competitor gap depth page","s9 download blocked by Chrome Pakistan","blog/s9-download-blocked-by-chrome-2026-06-30/","chrome-download-block"
"ranking-push","Competitor gap depth page","s9 apk download not starting Pakistan","blog/s9-apk-download-not-starting-2026-07-01/","download-start-failure"
"ranking-push","Competitor gap depth page","s9 download failed after update Pakistan","blog/s9-download-failed-after-update-2026-07-02/","download-after-update-failed"
"ranking-push","Competitor gap depth page","s9 download failed after update Pakistan","blog/s9-download-failed-after-update-2026-07-03/","download-after-update-failed"
"ranking-push","Competitor intent depth","s9 game","blog/s9-game-download-guide-2026-07-03/","s9-game-download-fail-overview"
"ranking-push","Competitor intent depth","s9 game","blog/s9-download-page-indexing-check-2026-07-04/","s9-game-download-fail-overview"
"ranking-push","Competitor intent depth","s9 game","blog/s9-download-not-opening-android-fix-2026-07-05/","s9-game-download-fail-overview"
"ranking-push","Competitor intent depth","s9 game","blog/s9-download-not-opening-android-fix-2026-07-07/","s9-game-download-fail-overview"
"ranking-push","Competitor intent depth","s9 game","blog/s9-download-button-not-responding-chrome-fix-2026-07-09/","s9-game-download-fail-overview"
"ranking-push","Competitor intent depth","s9 game","blog/s9-download-button-not-responding-chrome-fix-2026-07-10/","s9-game-download-fail-overview"
"ranking-push","Competitor intent depth","s9 game","blog/s9-download-button-not-responding-chrome-fix-2026-07-11/","s9-game-download-fail-overview"
"14","weekly update","s9 game official download link","updates/week-14-download-link-health-check/","Freshness and troubleshooting alignment"

